song_id,stanza,position,title,Text,,,,,,,,,,,,,,,,,,,,,,,,,,,,,,,,,,,,,,,,,,,
11.56_UND_T2_,1,38,,То найстарший ж брат до свого найменшого пішого-піхотинця словами промовляє:,,,,,,,,,,,,,,,,,,,,,,,,,,,,,,,,,,,,,,,,,,,
11.56_UND_T2_,1,39,,"«Що ми ж тебе, брате, на коні не візьмемо,",,,,,,,,,,,,,,,,,,,,,,,,,,,,,,,,,,,,,,,,,,,
11.56_UND_T2_,1,40,,Із тобою ми не підемо.,,,,,,,,,,,,,,,,,,,,,,,,,,,,,,,,,,,,,,,,,,,
11.56_UND_T2_,1,41,,"А як жив ти будеш,",,,,,,,,,,,,,,,,,,,,,,,,,,,,,,,,,,,,,,,,,,,
11.56_UND_T2_,1,42,,То і сам в христіянські городи без наших коней прибудеш».,,,,,,,,,,,,,,,,,,,,,,,,,,,,,,,,,,,,,,,,,,,
11.56_UND_T2_,1,43,,"То найменший брат теє зачуває,",,,,,,,,,,,,,,,,,,,,,,,,,,,,,,,,,,,,,,,,,,,
11.56_UND_T2_,1,44,,Він білим лицем до сирої землі упадає,,,,,,,,,,,,,,,,,,,,,,,,,,,,,,,,,,,,,,,,,,,
11.56_UND_T2_,1,45,,Та до своїх братів ріднесеньких словами промовляє:,,,,,,,,,,,,,,,,,,,,,,,,,,,,,,,,,,,,,,,,,,,
11.56_UND_T2_,1,46,,"«Братіки мої милі,",,,,,,,,,,,,,,,,,,,,,,,,,,,,,,,,,,,,,,,,,,,
11.56_UND_T2_,1,47,,"Голубчики сиві,",,,,,,,,,,,,,,,,,,,,,,,,,,,,,,,,,,,,,,,,,,,
11.56_UND_T2_,1,48,,Хоч малую милость надо мною положите:,,,,,,,,,,,,,,,,,,,,,,,,,,,,,,,,,,,,,,,,,,,
11.56_UND_T2_,1,49,,"Та ви своїх коней козацьких молодецьких ізпиніте,",,,,,,,,,,,,,,,,,,,,,,,,,,,,,,,,,,,,,,,,,,,
11.56_UND_T2_,1,50,,"Та шаблі булатні із пихов вийміте,",,,,,,,,,,,,,,,,,,,,,,,,,,,,,,,,,,,,,,,,,,,
11.56_UND_T2_,1,51,,А з плеч головоньку мою зніміте,,,,,,,,,,,,,,,,,,,,,,,,,,,,,,,,,,,,,,,,,,,
11.56_UND_T2_,1,52,,"Та білоє тіло моє козацькоє, молодецькоє в чистім полі поховайте,",,,,,,,,,,,,,,,,,,,,,,,,,,,,,,,,,,,,,,,,,,,
11.56_UND_T2_,1,53,,А звірям і птицям на поталу його не дайте.,,,,,,,,,,,,,,,,,,,,,,,,,,,,,,,,,,,,,,,,,,,
11.56_UND_T2_,1,54,,"То лучче ж то буде моєму тілу козацькому, молодецькому в сирій землі гнити,",,,,,,,,,,,,,,,,,,,,,,,,,,,,,,,,,,,,,,,,,,,
11.56_UND_T2_,1,55,,"Аніж мені туркам та вірменам, невірним язикам, та їм же годити!»",,,,,,,,,,,,,,,,,,,,,,,,,,,,,,,,,,,,,,,,,,,
11.56_UND_T2_,1,56,,То середульший же брат сеє зачуває,,,,,,,,,,,,,,,,,,,,,,,,,,,,,,,,,,,,,,,,,,,
11.56_UND_T2_,1,57,,Та до свого брата найменшого словами промовляє:,,,,,,,,,,,,,,,,,,,,,,,,,,,,,,,,,,,,,,,,,,,
11.56_UND_T2_,1,58,,"«Братіку ти наш милий,",,,,,,,,,,,,,,,,,,,,,,,,,,,,,,,,,,,,,,,,,,,
11.56_UND_T2_,1,59,,"Голубчику ти наш сивий,",,,,,,,,,,,,,,,,,,,,,,,,,,,,,,,,,,,,,,,,,,,
11.56_UND_T2_,1,60,,"Що рученька наша на тебе не зніметься,",,,,,,,,,,,,,,,,,,,,,,,,,,,,,,,,,,,,,,,,,,,
11.56_UND_T2_,1,61,,І серце наше на тебе не осмілиться,,,,,,,,,,,,,,,,,,,,,,,,,,,,,,,,,,,,,,,,,,,
11.56_UND_T2_,1,62,,"Та щоб же тебе, брате, рубати,",,,,,,,,,,,,,,,,,,,,,,,,,,,,,,,,,,,,,,,,,,,
11.56_UND_T2_,1,63,,З плеч головочку твою знімати,,,,,,,,,,,,,,,,,,,,,,,,,,,,,,,,,,,,,,,,,,,
11.56_UND_T2_,1,64,,Та щоб же свою брацькую кров рідную по сирій землі поливати.,,,,,,,,,,,,,,,,,,,,,,,,,,,,,,,,,,,,,,,,,,,
11.56_UND_T2_,1,65,,"А буду ж я, братіку мій милий",,,,,,,,,,,,,,,,,,,,,,,,,,,,,,,,,,,,,,,,,,,
11.56_UND_T2_,1,66,,"Голубчику сивий,",,,,,,,,,,,,,,,,,,,,,,,,,,,,,,,,,,,,,,,,,,,
11.56_UND_T2_,1,67,,"Мимо темних лісів проїзжати,",,,,,,,,,,,,,,,,,,,,,,,,,,,,,,,,,,,,,,,,,,,
11.56_UND_T2_,1,68,,"То буду ж я, брате із чорного дуба верхів’я стинати",,,,,,,,,,,,,,,,,,,,,,,,,,,,,,,,,,,,,,,,,,,
11.56_UND_T2_,1,69,,"Та все тобі буду, брате, на прикмету покидати,",,,,,,,,,,,,,,,,,,,,,,,,,,,,,,,,,,,,,,,,,,,
11.56_UND_T2_,1,70,,"А щоб ти ж, бідний, знав куди із города із Озова,",,,,,,,,,,,,,,,,,,,,,,,,,,,,,,,,,,,,,,,,,,,
11.56_UND_T2_,1,71,,"Із турецької, із бусурменської, із тяжкої неволі",,,,,,,,,,,,,,,,,,,,,,,,,,,,,,,,,,,,,,,,,,,
11.56_UND_T2_,1,72,,В христіанські городи куди утікати».,,,,,,,,,,,,,,,,,,,,,,,,,,,,,,,,,,,,,,,,,,,
11.56_UND_T2_,1,73,,То цеє ж вони промовляли,,,,,,,,,,,,,,,,,,,,,,,,,,,,,,,,,,,,,,,,,,,
11.56_UND_T2_,1,74,,Та свої коні козацькі молодецькі дальше поганяли.,,,,,,,,,,,,,,,,,,,,,,,,,,,,,,,,,,,,,,,,,,,
11.56_UND_T2_,1,75,,То став же той брат найменший,,,,,,,,,,,,,,,,,,,,,,,,,,,,,,,,,,,,,,,,,,,
11.56_UND_T2_,1,76,,Піший-піхотинець,,,,,,,,,,,,,,,,,,,,,,,,,,,,,,,,,,,,,,,,,,,
11.56_UND_T2_,1,77,,"До темних лісів добігати,",,,,,,,,,,,,,,,,,,,,,,,,,,,,,,,,,,,,,,,,,,,
11.56_UND_T2_,1,78,,"То став же він із чорного дуба верхів’я ізнаходжати,",,,,,,,,,,,,,,,,,,,,,,,,,,,,,,,,,,,,,,,,,,,
11.56_UND_T2_,1,79,,"Та став же він у руки козацькії хапати,",,,,,,,,,,,,,,,,,,,,,,,,,,,,,,,,,,,,,,,,,,,
11.56_UND_T2_,1,80,,До серця козацького прикладати,,,,,,,,,,,,,,,,,,,,,,,,,,,,,,,,,,,,,,,,,,,
11.56_UND_T2_,1,81,,"Та словами промовляти,",,,,,,,,,,,,,,,,,,,,,,,,,,,,,,,,,,,,,,,,,,,
11.56_UND_T2_,1,82,,Гірко сльозами ридати.,,,,,,,,,,,,,,,,,,,,,,,,,,,,,,,,,,,,,,,,,,,
11.56_UND_T2_,1,83,,"«Сюди ж то мої братіки миленькі,",,,,,,,,,,,,,,,,,,,,,,,,,,,,,,,,,,,,,,,,,,,
11.56_UND_T2_,1,84,,"Як голубчики сивенькі, проїзжали,",,,,,,,,,,,,,,,,,,,,,,,,,,,,,,,,,,,,,,,,,,,
11.56_UND_T2_,1,85,,"Що вони ж мені, бідному козакові,",,,,,,,,,,,,,,,,,,,,,,,,,,,,,,,,,,,,,,,,,,,
11.56_UND_T2_,1,86,,"Пішому-піхотинцю,",,,,,,,,,,,,,,,,,,,,,,,,,,,,,,,,,,,,,,,,,,,
11.56_UND_T2_,1,87,,У христіанські городи дороженьку указали».,,,,,,,,,,,,,,,,,,,,,,,,,,,,,,,,,,,,,,,,,,,
11.56_UND_T2_,1,88,,"А як стали два брати кінних на чистоє поле вибігати,",,,,,,,,,,,,,,,,,,,,,,,,,,,,,,,,,,,,,,,,,,,
11.56_UND_T2_,1,89,,"Що вже там не було ні тернів, ні байраків,",,,,,,,,,,,,,,,,,,,,,,,,,,,,,,,,,,,,,,,,,,,
11.56_UND_T2_,1,90,,"Ні з чого було верхів’я ломати,",,,,,,,,,,,,,,,,,,,,,,,,,,,,,,,,,,,,,,,,,,,
11.56_UND_T2_,1,91,,"Тому піхотинцю на прикмету покидати,",,,,,,,,,,,,,,,,,,,,,,,,,,,,,,,,,,,,,,,,,,,
11.56_UND_T2_,1,92,,"То середульший же брат милосердіє має,",,,,,,,,,,,,,,,,,,,,,,,,,,,,,,,,,,,,,,,,,,,
11.56_UND_T2_,1,93,,До свого брата найстаршого словами промовляє:,,,,,,,,,,,,,,,,,,,,,,,,,,,,,,,,,,,,,,,,,,,
11.56_UND_T2_,1,94,,"«Братіку мій миленький,",,,,,,,,,,,,,,,,,,,,,,,,,,,,,,,,,,,,,,,,,,,
11.56_UND_T2_,1,95,,"Голубчику сивенький,",,,,,,,,,,,,,,,,,,,,,,,,,,,,,,,,,,,,,,,,,,,
11.56_UND_T2_,1,96,,"Давай же тепер ми хоч із зелених жупанів жовту та червону китайку видирати,",,,,,,,,,,,,,,,,,,,,,,,,,,,,,,,,,,,,,,,,,,,
11.56_UND_T2_,1,97,,"Та свому брату меншому,",,,,,,,,,,,,,,,,,,,,,,,,,,,,,,,,,,,,,,,,,,,
11.56_UND_T2_,1,98,,Пішому-піхотинцю,,,,,,,,,,,,,,,,,,,,,,,,,,,,,,,,,,,,,,,,,,,
11.56_UND_T2_,1,99,,На прикмету покидати».,,,,,,,,,,,,,,,,,,,,,,,,,,,,,,,,,,,,,,,,,,,
11.56_UND_T2_,1,100,,То найстарший брат все він гордо має,,,,,,,,,,,,,,,,,,,,,,,,,,,,,,,,,,,,,,,,,,,
11.56_UND_T2_,1,101,,До середульшого брата гордо словами промовляє:,,,,,,,,,,,,,,,,,,,,,,,,,,,,,,,,,,,,,,,,,,,
11.56_UND_T2_,1,102,,"«Давай-но ми, брате, свої коні скоріше поганяти,",,,,,,,,,,,,,,,,,,,,,,,,,,,,,,,,,,,,,,,,,,,
11.56_UND_T2_,1,103,,"То будем же ми уперед свого брата найменшого,",,,,,,,,,,,,,,,,,,,,,,,,,,,,,,,,,,,,,,,,,,,
11.56_UND_T2_,1,104,,"Пішого-піхотинця,",,,,,,,,,,,,,,,,,,,,,,,,,,,,,,,,,,,,,,,,,,,
11.56_UND_T2_,1,105,,"До отця, до матері доїзжати,",,,,,,,,,,,,,,,,,,,,,,,,,,,,,,,,,,,,,,,,,,,
11.56_UND_T2_,1,106,,"То будем же ми отцевськоє превеликоє іменіє на дві части тільки розділяти,",,,,,,,,,,,,,,,,,,,,,,,,,,,,,,,,,,,,,,,,,,,
11.56_UND_T2_,1,107,,То не буде наш брат найменший піший-піхотинець а нам він мішати».,,,,,,,,,,,,,,,,,,,,,,,,,,,,,,,,,,,,,,,,,,,
11.56_UND_T2_,1,108,,"А стали ті два брати кінних до Савур-могили доїзжати,",,,,,,,,,,,,,,,,,,,,,,,,,,,,,,,,,,,,,,,,,,,
11.56_UND_T2_,1,109,,"І стали їх коні козацькі, молодецькі приставати,",,,,,,,,,,,,,,,,,,,,,,,,,,,,,,,,,,,,,,,,,,,
11.56_UND_T2_,1,110,,То середульший брат милосердіє має,,,,,,,,,,,,,,,,,,,,,,,,,,,,,,,,,,,,,,,,,,,
11.56_UND_T2_,1,111,,До свого старшого брата промовляє:,,,,,,,,,,,,,,,,,,,,,,,,,,,,,,,,,,,,,,,,,,,
11.56_UND_T2_,1,112,,"«Братіку мій милий,",,,,,,,,,,,,,,,,,,,,,,,,,,,,,,,,,,,,,,,,,,,
11.56_UND_T2_,1,113,,"Голубчику сивий,",,,,,,,,,,,,,,,,,,,,,,,,,,,,,,,,,,,,,,,,,,,
11.56_UND_T2_,1,114,,"Тут же трави зелені і води великі,",,,,,,,,,,,,,,,,,,,,,,,,,,,,,,,,,,,,,,,,,,,
11.56_UND_T2_,1,115,,"Давай же ми, брате, свої коні попасемо,",,,,,,,,,,,,,,,,,,,,,,,,,,,,,,,,,,,,,,,,,,,
11.56_UND_T2_,1,116,,"Та свого брата найменшого, пішого-піхотинця, надождемо».",,,,,,,,,,,,,,,,,,,,,,,,,,,,,,,,,,,,,,,,,,,
11.56_UND_T2_,1,117,,То найстарший же брат гордо має,,,,,,,,,,,,,,,,,,,,,,,,,,,,,,,,,,,,,,,,,,,
11.56_UND_T2_,1,118,,Він же до свого брата середульшого гордо промовляє:,,,,,,,,,,,,,,,,,,,,,,,,,,,,,,,,,,,,,,,,,,,
11.56_UND_T2_,1,119,,"«Як же ми будемо до отця, до матері прибувати,",,,,,,,,,,,,,,,,,,,,,,,,,,,,,,,,,,,,,,,,,,,
11.56_UND_T2_,1,120,,Що ж ми будемо їм повідати ?,,,,,,,,,,,,,,,,,,,,,,,,,,,,,,,,,,,,,,,,,,,
11.56_UND_T2_,1,121,,"Будем же, брате, по правді казати,",,,,,,,,,,,,,,,,,,,,,,,,,,,,,,,,,,,,,,,,,,,
11.56_UND_T2_,1,122,,"Буде отець-мати нас проклинати,",,,,,,,,,,,,,,,,,,,,,,,,,,,,,,,,,,,,,,,,,,,
11.56_UND_T2_,1,123,,"А будемо перед отцем і матерію олгати,",,,,,,,,,,,,,,,,,,,,,,,,,,,,,,,,,,,,,,,,,,,
11.56_UND_T2_,1,124,,То буде нас Господь милосердний видимо і невидимо карати.,,,,,,,,,,,,,,,,,,,,,,,,,,,,,,,,,,,,,,,,,,,
11.56_UND_T2_,1,125,,"А хіба скажемо, брате, так:",,,,,,,,,,,,,,,,,,,,,,,,,,,,,,,,,,,,,,,,,,,
11.56_UND_T2_,1,126,,"Що не в одного пана пробували,",,,,,,,,,,,,,,,,,,,,,,,,,,,,,,,,,,,,,,,,,,,
11.56_UND_T2_,1,127,,"І не одну волю мали,",,,,,,,,,,,,,,,,,,,,,,,,,,,,,,,,,,,,,,,,,,,
11.56_UND_T2_,1,128,,І ми ночної доби до нього забігали:,,,,,,,,,,,,,,,,,,,,,,,,,,,,,,,,,,,,,,,,,,,
11.56_UND_T2_,1,129,,"“Встань, брате, з нами, козаками,",,,,,,,,,,,,,,,,,,,,,,,,,,,,,,,,,,,,,,,,,,,
11.56_UND_T2_,1,130,,З тяжкої неволі утікати”.,,,,,,,,,,,,,,,,,,,,,,,,,,,,,,,,,,,,,,,,,,,
11.56_UND_T2_,1,131,,Тоді ж він так сказав:,,,,,,,,,,,,,,,,,,,,,,,,,,,,,,,,,,,,,,,,,,,
11.56_UND_T2_,1,132,,"“Тікайте ж ви, братця,",,,,,,,,,,,,,,,,,,,,,,,,,,,,,,,,,,,,,,,,,,,
11.56_UND_T2_,1,133,,"А я буду тут зоставаться,",,,,,,,,,,,,,,,,,,,,,,,,,,,,,,,,,,,,,,,,,,,
11.56_UND_T2_,1,134,,Чи не буду луччого щастя-долі собі мати”.,,,,,,,,,,,,,,,,,,,,,,,,,,,,,,,,,,,,,,,,,,,
11.56_UND_T2_,1,135,,"Як будуть отець і мати помірати,",,,,,,,,,,,,,,,,,,,,,,,,,,,,,,,,,,,,,,,,,,,
11.56_UND_T2_,1,136,,"То будем грунти-худобу на дві части паювати,",,,,,,,,,,,,,,,,,,,,,,,,,,,,,,,,,,,,,,,,,,,
11.56_UND_T2_,1,137,,А третій же ж нам не буде мішати».,,,,,,,,,,,,,,,,,,,,,,,,,,,,,,,,,,,,,,,,,,,
11.56_UND_T2_,1,138,,Тут сеє промовляють.,,,,,,,,,,,,,,,,,,,,,,,,,,,,,,,,,,,,,,,,,,,
11.56_UND_T2_,1,139,,"Не сизі орли заклекотали,",,,,,,,,,,,,,,,,,,,,,,,,,,,,,,,,,,,,,,,,,,,
11.56_UND_T2_,1,140,,"Як їх турки-яничари із-за могили напали,",,,,,,,,,,,,,,,,,,,,,,,,,,,,,,,,,,,,,,,,,,,
11.56_UND_T2_,1,141,,"Постріляли-порубали,",,,,,,,,,,,,,,,,,,,,,,,,,,,,,,,,,,,,,,,,,,,
11.56_UND_T2_,1,142,,"А коней із добичею в городи, в Туреччину назад вертали.",,,,,,,,,,,,,,,,,,,,,,,,,,,,,,,,,,,,,,,,,,,
11.56_UND_T2_,1,143,,Полягла голова двох братів,,,,,,,,,,,,,,,,,,,,,,,,,,,,,,,,,,,,,,,,,,,
11.56_UND_T2_,1,144,,"Вище річки Самарки,",,,,,,,,,,,,,,,,,,,,,,,,,,,,,,,,,,,,,,,,,,,
11.56_UND_T2_,1,145,,"А третього, – меншого,",,,,,,,,,,,,,,,,,,,,,,,,,,,,,,,,,,,,,,,,,,,
11.56_UND_T2_,1,146,,На Савур-могилі.,,,,,,,,,,,,,,,,,,,,,,,,,,,,,,,,,,,,,,,,,,,
11.56_UND_T2_,1,147,,А слава не вмре,,,,,,,,,,,,,,,,,,,,,,,,,,,,,,,,,,,,,,,,,,,
11.56_UND_T2_,1,148,,"Не поляже,",,,,,,,,,,,,,,,,,,,,,,,,,,,,,,,,,,,,,,,,,,,
11.56_UND_T2_,1,149,,"Однині й довіка,",,,,,,,,,,,,,,,,,,,,,,,,,,,,,,,,,,,,,,,,,,,
11.56_UND_T2_,1,150,,А вам на многая літа!,,,,,,,,,,,,,,,,,,,,,,,,,,,,,,,,,,,,,,,,,,,
11.57_UND_T2_,1,1,Дума про трьох братів Озовських 11.57,"Ой із города из Озова утікав мал полчок, бул невеличок.",,,,,,,,,,,,,,,,,,,,,,,,,,,,,,,,,,,,,,,,,,,
11.57_UND_T2_,1,2,,"Єк було собі три братіки родненьки, голубчики сивеньки, товарищи сердечні",,,,,,,,,,,,,,,,,,,,,,,,,,,,,,,,,,,,,,,,,,,
11.57_UND_T2_,1,3,,"То два братіки кинная конаница, треті брат пїшая пешаница, да так же єк чужая чужаница",,,,,,,,,,,,,,,,,,,,,,,,,,,,,,,,,,,,,,,,,,,
11.57_UND_T2_,1,4,,"Шо ти два братіки їдуть-поєжджають, а менши (трейті) брат бежить - пудбігає, стиха словами промовляє:",,,,,,,,,,,,,,,,,,,,,,,,,,,,,,,,,,,,,,,,,,,
11.57_UND_T2_,1,5,,"«Братіки мої родненьки, голубчики сивеньки, товариши сердечні,",,,,,,,,,,,,,,,,,,,,,,,,,,,,,,,,,,,,,,,,,,,
11.57_UND_T2_,1,6,,"Станьте й коней попасіте, мене, меншого брата, зождіте да с собою на коні возьміте,",,,,,,,,,,,,,,,,,,,,,,,,,,,,,,,,,,,,,,,,,,,
11.57_UND_T2_,1,7,,У города у християнськи мене хоть по помилі (по милості) мене ж пудвезіте».,,,,,,,,,,,,,,,,,,,,,,,,,,,,,,,,,,,,,,,,,,,
11.57_UND_T2_,1,8,,Тогда то старши брат ізгора промовляє:,,,,,,,,,,,,,,,,,,,,,,,,,,,,,,,,,,,,,,,,,,,
11.57_UND_T2_,1,9,,"«Нашо ми будем коней попасати, свого меншого брата ждати.",,,,,,,,,,,,,,,,,,,,,,,,,,,,,,,,,,,,,,,,,,,
11.57_UND_T2_,1,10,,Сами (лучче) ми будем удвох у городи християнськи прибувати,,,,,,,,,,,,,,,,,,,,,,,,,,,,,,,,,,,,,,,,,,,
11.57_UND_T2_,1,11,,Да напол будем худобу пайовати,,,,,,,,,,,,,,,,,,,,,,,,,,,,,,,,,,,,,,,,,,,
11.57_UND_T2_,1,12,,Й а трейтюю чась поміждо собою».,,,,,,,,,,,,,,,,,,,,,,,,,,,,,,,,,,,,,,,,,,,
11.57_UND_T2_,1,13,,Середульши брат стиха словами промовляє (одвічає):,,,,,,,,,,,,,,,,,,,,,,,,,,,,,,,,,,,,,,,,,,,
11.57_UND_T2_,1,14,,«Ходж же ми сами будем в города християнськи прибувати (Ходж же ми сами будем прибувати),,,,,,,,,,,,,,,,,,,,,,,,,,,,,,,,,,,,,,,,,,,
11.57_UND_T2_,1,15,,"Да напол худобу будем пайовати,",,,,,,,,,,,,,,,,,,,,,,,,,,,,,,,,,,,,,,,,,,,
11.57_UND_T2_,1,16,,"То до вїку вїшнєго ми не будем же мати,",,,,,,,,,,,,,,,,,,,,,,,,,,,,,,,,,,,,,,,,,,,
11.57_UND_T2_,1,17,,"Єку ми оцу правду, матери будем казати?»",,,,,,,,,,,,,,,,,,,,,,,,,,,,,,,,,,,,,,,,,,,
11.57_UND_T2_,1,18,,"«Не в одной Турещині пробували,",,,,,,,,,,,,,,,,,,,,,,,,,,,,,,,,,,,,,,,,,,,
11.57_UND_T2_,1,19,,"Не один хліб-соль уживали,",,,,,,,,,,,,,,,,,,,,,,,,,,,,,,,,,,,,,,,,,,,
11.57_UND_T2_,1,20,,"Да не знаєм один об одному, де хто дівся».",,,,,,,,,,,,,,,,,,,,,,,,,,,,,,,,,,,,,,,,,,,
11.57_UND_T2_,1,21,,"Тогда то менши брат бежить-пудбігає,",,,,,,,,,,,,,,,,,,,,,,,,,,,,,,,,,,,,,,,,,,,
11.57_UND_T2_,1,22,,Стиха словами промовляє:,,,,,,,,,,,,,,,,,,,,,,,,,,,,,,,,,,,,,,,,,,,
11.57_UND_T2_,1,23,,"«Братіки мої родненьки, голубчики сивеньки, товариши сердечні,",,,,,,,,,,,,,,,,,,,,,,,,,,,,,,,,,,,,,,,,,,,
11.57_UND_T2_,1,24,,"Станьте, коней попасіте, мене меншого брата зождіте",,,,,,,,,,,,,,,,,,,,,,,,,,,,,,,,,,,,,,,,,,,
11.57_UND_T2_,1,25,,"І с собою на коні возьміте,",,,,,,,,,,,,,,,,,,,,,,,,,,,,,,,,,,,,,,,,,,,
11.57_UND_T2_,1,26,,В города в християнськи мене хоть по помилі пудвезіте;,,,,,,,,,,,,,,,,,,,,,,,,,,,,,,,,,,,,,,,,,,,
11.57_UND_T2_,1,27,,"А коли головку мині іс пліч єк галку ізніміте,",,,,,,,,,,,,,,,,,,,,,,,,,,,,,,,,,,,,,,,,,,,
11.57_UND_T2_,1,28,,Да не подайте ж мене туркам безбожним мене на поталу».,,,,,,,,,,,,,,,,,,,,,,,,,,,,,,,,,,,,,,,,,,,
11.57_UND_T2_,1,29,,"Тогда то старши брат іспуд правого бока м’їч вимає,",,,,,,,,,,,,,,,,,,,,,,,,,,,,,,,,,,,,,,,,,,,
11.57_UND_T2_,1,30,,Середильши́ брат голою рукою за мїч хватає,,,,,,,,,,,,,,,,,,,,,,,,,,,,,,,,,,,,,,,,,,,
11.57_UND_T2_,1,31,,Да ще стиха словами промовляє:,,,,,,,,,,,,,,,,,,,,,,,,,,,,,,,,,,,,,,,,,,,
11.57_UND_T2_,1,32,,"«Мїч твоя не возьми́ і рука твоя не здими́,",,,,,,,,,,,,,,,,,,,,,,,,,,,,,,,,,,,,,,,,,,,
11.57_UND_T2_,1,33,,"А ходж же (А хоч) мїч твоя визьме і рука твоя здиме,",,,,,,,,,,,,,,,,,,,,,,,,,,,,,,,,,,,,,,,,,,,
11.57_UND_T2_,1,34,,То до вїку вїшнєго наша душа греху́в не скупицца.,,,,,,,,,,,,,,,,,,,,,,,,,,,,,,,,,,,,,,,,,,,
11.57_UND_T2_,1,35,,"Лучче ж ми будем їхати-поєжджати,",,,,,,,,,,,,,,,,,,,,,,,,,,,,,,,,,,,,,,,,,,,
11.57_UND_T2_,1,36,,Тернам да бар’якам будем верхи стинати,,,,,,,,,,,,,,,,,,,,,,,,,,,,,,,,,,,,,,,,,,,
11.57_UND_T2_,1,37,,Да свойму меншому брату будем на примету покидати».,,,,,,,,,,,,,,,,,,,,,,,,,,,,,,,,,,,,,,,,,,,
11.57_UND_T2_,1,38,,"Виєжджали вони на стипа́ самарськи, на поля муравськи,",,,,,,,,,,,,,,,,,,,,,,,,,,,,,,,,,,,,,,,,,,,
11.57_UND_T2_,1,39,,"Не стало їм не тирнов, не бар’яков, не трейтіх козацких же, молодецких же признаков.",,,,,,,,,,,,,,,,,,,,,,,,,,,,,,,,,,,,,,,,,,,
11.57_UND_T2_,1,40,,"(Тогда-то) середульши брат великеє усердіє має,",,,,,,,,,,,,,,,,,,,,,,,,,,,,,,,,,,,,,,,,,,,
11.57_UND_T2_,1,41,,На собі чирвону китайку пориває,,,,,,,,,,,,,,,,,,,,,,,,,,,,,,,,,,,,,,,,,,,
11.57_UND_T2_,1,42,,Да меншому брату на прикмету єму покидає.,,,,,,,,,,,,,,,,,,,,,,,,,,,,,,,,,,,,,,,,,,,
11.57_UND_T2_,1,43,,"А менши брат бежить-пудбігає,",,,,,,,,,,,,,,,,,,,,,,,,,,,,,,,,,,,,,,,,,,,
11.57_UND_T2_,1,44,,"Чирвону китайку знахождає,",,,,,,,,,,,,,,,,,,,,,,,,,,,,,,,,,,,,,,,,,,,
11.57_UND_T2_,1,45,,"Да к щирому свойму серцу прикладає,",,,,,,,,,,,,,,,,,,,,,,,,,,,,,,,,,,,,,,,,,,,
11.57_UND_T2_,1,46,,Стиха словами промовляє:,,,,,,,,,,,,,,,,,,,,,,,,,,,,,,,,,,,,,,,,,,,
11.57_UND_T2_,1,47,,"«Братіки мої родненьки, голубчики сивеньки, товариши сердечні,",,,,,,,,,,,,,,,,,,,,,,,,,,,,,,,,,,,,,,,,,,,
11.57_UND_T2_,1,48,,"Да чи вас постреляли, чи вас порубали, чи в катержну роботу побрали?",,,,,,,,,,,,,,,,,,,,,,,,,,,,,,,,,,,,,,,,,,,
11.57_UND_T2_,1,49,,"Шо мог би я вас изнаходити,",,,,,,,,,,,,,,,,,,,,,,,,,,,,,,,,,,,,,,,,,,,
11.57_UND_T2_,1,50,,То в сиру землю (хоть) по коліна мог би схоронити».,,,,,,,,,,,,,,,,,,,,,,,,,,,,,,,,,,,,,,,,,,,
11.57_UND_T2_,1,51,,"А вин козак уп субі не знає,",,,,,,,,,,,,,,,,,,,,,,,,,,,,,,,,,,,,,,,,,,,
11.57_UND_T2_,1,52,,Шо його в чистим полі троє й нещастьов споткає.,,,,,,,,,,,,,,,,,,,,,,,,,,,,,,,,,,,,,,,,,,,
11.57_UND_T2_,1,53,,"Первоє нещастє бесхліб’є, друге безвиддє, а трейтє козацке же молодецке же безголив’є.",,,,,,,,,,,,,,,,,,,,,,,,,,,,,,,,,,,,,,,,,,,
11.57_UND_T2_,1,54,,І виходить вин на чистеє поле ик Савур-могилі:,,,,,,,,,,,,,,,,,,,,,,,,,,,,,,,,,,,,,,,,,,,
11.57_UND_T2_,1,55,,"«Савур-могила, Савур, буд же мині при нещасний годині отєц єк мать родниє».",,,,,,,,,,,,,,,,,,,,,,,,,,,,,,,,,,,,,,,,,,,
11.57_UND_T2_,1,56,,"Єк вин сеє зговорив, так баздер добри учинив,",,,,,,,,,,,,,,,,,,,,,,,,,,,,,,,,,,,,,,,,,,,
11.57_UND_T2_,1,57,,"Ногами не пийде, руками не здийме, голови козацкої молодецкої вин уже пидниме.",,,,,,,,,,,,,,,,,,,,,,,,,,,,,,,,,,,,,,,,,,,
11.57_UND_T2_,1,58,,"Тогда то сизопїрли орли налетали, на чорниє йому кудли наступали да з лоба ґлаза винімали.",,,,,,,,,,,,,,,,,,,,,,,,,,,,,,,,,,,,,,,,,,,
11.57_UND_T2_,1,59,,"А козак непишен бивав, згора уставав, да безмїру в пистони пороху покладав,",,,,,,,,,,,,,,,,,,,,,,,,,,,,,,,,,,,,,,,,,,,
11.57_UND_T2_,1,60,,Да гостям своїм невїрним гостинец же вин їм слав:,,,,,,,,,,,,,,,,,,,,,,,,,,,,,,,,,,,,,,,,,,,
11.57_UND_T2_,1,61,,"«Орли ви мої сизопїрли, гості ви мої невїрни,",,,,,,,,,,,,,,,,,,,,,,,,,,,,,,,,,,,,,,,,,,,
11.57_UND_T2_,1,62,,"Тоді (Тогда) ви будете прилетати (налетати), єк моя грїшна душа ис тілом буде прощеніє мати».",,,,,,,,,,,,,,,,,,,,,,,,,,,,,,,,,,,,,,,,,,,
11.57_UND_T2_,1,63,,"Изнизу из Нистра стиха вїтер повиває, дробен дорщик накрапає, синя й хмара наступає.",,,,,,,,,,,,,,,,,,,,,,,,,,,,,,,,,,,,,,,,,,,
11.57_UND_T2_,1,64,,Тоді (Тогда) грїшная душа козацка молодецка ис тілом прощенє ж вона має.,,,,,,,,,,,,,,,,,,,,,,,,,,,,,,,,,,,,,,,,,,,
11.57_UND_T2_,1,65,,Тогда (Й а) ти два братіки їдуть-поєжджають,,,,,,,,,,,,,,,,,,,,,,,,,,,,,,,,,,,,,,,,,,,
11.57_UND_T2_,1,66,,"Доєждждають вони до криници Салтанки, до рїчки Валґанки.",,,,,,,,,,,,,,,,,,,,,,,,,,,,,,,,,,,,,,,,,,,
11.57_UND_T2_,1,67,,"Тогда то середульши брат велике всердіє має,",,,,,,,,,,,,,,,,,,,,,,,,,,,,,,,,,,,,,,,,,,,
11.57_UND_T2_,1,68,,На старшого брата стиха словами промовляє:,,,,,,,,,,,,,,,,,,,,,,,,,,,,,,,,,,,,,,,,,,,
