song_id,stanza,position,title,Text,,,,,,,,,,,,,,,,,,,,,,,,,,,,,,,,,,,,,,,,,,,
11.17_UND_T2_,1,158,,"Батькову-матчину молитву споминає,",,,,,,,,,,,,,,,,,,,,,,,,,,,,,,,,,,,,,,,,,,,
11.17_UND_T2_,1,159,,І Богу душу оддає.,,,,,,,,,,,,,,,,,,,,,,,,,,,,,,,,,,,,,,,,,,,
11.17_UND_T2_,1,160,,"Тойді сиві зозулі налітали,",,,,,,,,,,,,,,,,,,,,,,,,,,,,,,,,,,,,,,,,,,,
11.17_UND_T2_,1,161,,У головках сідали,,,,,,,,,,,,,,,,,,,,,,,,,,,,,,,,,,,,,,,,,,,
11.17_UND_T2_,1,162,,І так як рідні сестри куковали.,,,,,,,,,,,,,,,,,,,,,,,,,,,,,,,,,,,,,,,,,,,
11.17_UND_T2_,1,163,,"Тойді орли сизопері налітали,",,,,,,,,,,,,,,,,,,,,,,,,,,,,,,,,,,,,,,,,,,,
11.17_UND_T2_,1,164,,"На кудрі наступали,",,,,,,,,,,,,,,,,,,,,,,,,,,,,,,,,,,,,,,,,,,,
11.17_UND_T2_,1,165,,З лоба очі видирали.,,,,,,,,,,,,,,,,,,,,,,,,,,,,,,,,,,,,,,,,,,,
11.17_UND_T2_,1,166,,"І вовки-сіроманці набігали,",,,,,,,,,,,,,,,,,,,,,,,,,,,,,,,,,,,,,,,,,,,
11.17_UND_T2_,1,167,,"Кості по байраках, по мелюсах розношали.",,,,,,,,,,,,,,,,,,,,,,,,,,,,,,,,,,,,,,,,,,,
11.17_UND_T2_,1,168,,"А два брати кінниї до річки до Самари добігали,",,,,,,,,,,,,,,,,,,,,,,,,,,,,,,,,,,,,,,,,,,,
11.17_UND_T2_,1,169,,"І єдин до єдиного словами промовляли,",,,,,,,,,,,,,,,,,,,,,,,,,,,,,,,,,,,,,,,,,,,
11.17_UND_T2_,1,170,,Що промове до старшого середульший:,,,,,,,,,,,,,,,,,,,,,,,,,,,,,,,,,,,,,,,,,,,
11.17_UND_T2_,1,171,,"«Братіку рідненький,",,,,,,,,,,,,,,,,,,,,,,,,,,,,,,,,,,,,,,,,,,,
11.17_UND_T2_,1,172,,Голубоньку сивенький!,,,,,,,,,,,,,,,,,,,,,,,,,,,,,,,,,,,,,,,,,,,
11.17_UND_T2_,1,173,,"Добре ми вчинімо,",,,,,,,,,,,,,,,,,,,,,,,,,,,,,,,,,,,,,,,,,,,
11.17_UND_T2_,1,174,,Свої коні козацькиї напасемо й напоїмо:,,,,,,,,,,,,,,,,,,,,,,,,,,,,,,,,,,,,,,,,,,,
11.17_UND_T2_,1,175,,"Тут трави зелені, води холодні,",,,,,,,,,,,,,,,,,,,,,,,,,,,,,,,,,,,,,,,,,,,
11.17_UND_T2_,1,176,,Очерети воздобни». –,,,,,,,,,,,,,,,,,,,,,,,,,,,,,,,,,,,,,,,,,,,
11.17_UND_T2_,1,177,,"Каже: “Попасемо,",,,,,,,,,,,,,,,,,,,,,,,,,,,,,,,,,,,,,,,,,,,
11.17_UND_T2_,1,178,,Свого найменьшого брата підождемо».,,,,,,,,,,,,,,,,,,,,,,,,,,,,,,,,,,,,,,,,,,,
11.17_UND_T2_,1,179,,Тойді середульший брат до старшого брата словами промовляє:,,,,,,,,,,,,,,,,,,,,,,,,,,,,,,,,,,,,,,,,,,,
11.17_UND_T2_,1,180,,"«Братіку рідненький,",,,,,,,,,,,,,,,,,,,,,,,,,,,,,,,,,,,,,,,,,,,
11.17_UND_T2_,1,181,,Голубоньку сивенький!,,,,,,,,,,,,,,,,,,,,,,,,,,,,,,,,,,,,,,,,,,,
11.17_UND_T2_,1,182,,"Як дасть нам Господь до батька, до матері, до роду прибувати,",,,,,,,,,,,,,,,,,,,,,,,,,,,,,,,,,,,,,,,,,,,
11.17_UND_T2_,1,183,,"Як ми будем перед батьком, перед матірью отвіт оддавати?»",,,,,,,,,,,,,,,,,,,,,,,,,,,,,,,,,,,,,,,,,,,
11.17_UND_T2_,1,184,,"А старший брат теє зачуває,",,,,,,,,,,,,,,,,,,,,,,,,,,,,,,,,,,,,,,,,,,,
11.17_UND_T2_,1,185,,Словами промовляє:,,,,,,,,,,,,,,,,,,,,,,,,,,,,,,,,,,,,,,,,,,,
11.17_UND_T2_,1,186,,"«Лиш ми будем, середульший брате, перед отцем, перед маткою отвіт оддавати,",,,,,,,,,,,,,,,,,,,,,,,,,,,,,,,,,,,,,,,,,,,
11.17_UND_T2_,1,187,,"Лучше ми будем свою батьківщину удвох паювати,",,,,,,,,,,,,,,,,,,,,,,,,,,,,,,,,,,,,,,,,,,,
11.17_UND_T2_,1,188,,"Лиш ти будеш, середульший брате, перед батьком, перед маткою попереду отвіт оддавати,",,,,,,,,,,,,,,,,,,,,,,,,,,,,,,,,,,,,,,,,,,,
11.17_UND_T2_,1,189,,"І буде твоя голова від моёго меча із плич відпадати,",,,,,,,,,,,,,,,,,,,,,,,,,,,,,,,,,,,,,,,,,,,
11.17_UND_T2_,1,190,,Я могу отвіт і сам росказати».,,,,,,,,,,,,,,,,,,,,,,,,,,,,,,,,,,,,,,,,,,,
11.17_UND_T2_,1,191,,"И теє промовляли,",,,,,,,,,,,,,,,,,,,,,,,,,,,,,,,,,,,,,,,,,,,
11.17_UND_T2_,1,192,,Віттіля побігали.,,,,,,,,,,,,,,,,,,,,,,,,,,,,,,,,,,,,,,,,,,,
11.17_UND_T2_,1,193,,"І бігли не день, не два,",,,,,,,,,,,,,,,,,,,,,,,,,,,,,,,,,,,,,,,,,,,
11.17_UND_T2_,1,194,,Не три й не чотирі.,,,,,,,,,,,,,,,,,,,,,,,,,,,,,,,,,,,,,,,,,,,
11.17_UND_T2_,1,195,,"Четвертої неділі до отця, до матері добігали;",,,,,,,,,,,,,,,,,,,,,,,,,,,,,,,,,,,,,,,,,,,
11.17_UND_T2_,1,196,,"Отець да й мати за ворота виходили, на здоровьє питали:",,,,,,,,,,,,,,,,,,,,,,,,,,,,,,,,,,,,,,,,,,,
11.17_UND_T2_,1,197,,"«Сини наші, сини,",,,,,,,,,,,,,,,,,,,,,,,,,,,,,,,,,,,,,,,,,,,
11.17_UND_T2_,1,198,,"Два, як ясненькі соколи!",,,,,,,,,,,,,,,,,,,,,,,,,,,,,,,,,,,,,,,,,,,
11.17_UND_T2_,1,199,,Чи в одній ви неволі бували?,,,,,,,,,,,,,,,,,,,,,,,,,,,,,,,,,,,,,,,,,,,
11.17_UND_T2_,1,200,,Чи одному ви пану слуговали?,,,,,,,,,,,,,,,,,,,,,,,,,,,,,,,,,,,,,,,,,,,
11.17_UND_T2_,1,201,,Чи разом із неволі тяжкої втікали?»,,,,,,,,,,,,,,,,,,,,,,,,,,,,,,,,,,,,,,,,,,,
11.17_UND_T2_,1,202,,"Старший брат теє зачуває,",,,,,,,,,,,,,,,,,,,,,,,,,,,,,,,,,,,,,,,,,,,
11.17_UND_T2_,1,203,,Словами промовляє:,,,,,,,,,,,,,,,,,,,,,,,,,,,,,,,,,,,,,,,,,,,
11.17_UND_T2_,1,204,,«Батько і мати! Не в одній ми неволі бували.,,,,,,,,,,,,,,,,,,,,,,,,,,,,,,,,,,,,,,,,,,,
11.17_UND_T2_,1,205,,"Не одному пану слуговали,",,,,,,,,,,,,,,,,,,,,,,,,,,,,,,,,,,,,,,,,,,,
11.17_UND_T2_,1,206,,Не разом із тяжкої неволі втікали».,,,,,,,,,,,,,,,,,,,,,,,,,,,,,,,,,,,,,,,,,,,
11.17_UND_T2_,1,207,,"А середульший брат теє зачуває,",,,,,,,,,,,,,,,,,,,,,,,,,,,,,,,,,,,,,,,,,,,
11.17_UND_T2_,1,208,,"Із коня вставає,",,,,,,,,,,,,,,,,,,,,,,,,,,,,,,,,,,,,,,,,,,,
11.17_UND_T2_,1,209,,"Слезами обливає,",,,,,,,,,,,,,,,,,,,,,,,,,,,,,,,,,,,,,,,,,,,
11.17_UND_T2_,1,210,,"Перед отцем, перед маткою по правді отвіт оддаває:",,,,,,,,,,,,,,,,,,,,,,,,,,,,,,,,,,,,,,,,,,,
11.17_UND_T2_,1,211,,"«Отець да і мати! У одній ми неволі бували,",,,,,,,,,,,,,,,,,,,,,,,,,,,,,,,,,,,,,,,,,,,
11.17_UND_T2_,1,212,,І одному пану слуговали;,,,,,,,,,,,,,,,,,,,,,,,,,,,,,,,,,,,,,,,,,,,
11.17_UND_T2_,1,213,,І разом ми з тяжкої неволі втікали».,,,,,,,,,,,,,,,,,,,,,,,,,,,,,,,,,,,,,,,,,,,
11.17_UND_T2_,1,214,,"Отець да і мати старшого сина кляне, проклинає,",,,,,,,,,,,,,,,,,,,,,,,,,,,,,,,,,,,,,,,,,,,
11.17_UND_T2_,1,215,,"Із очей згоняє,",,,,,,,,,,,,,,,,,,,,,,,,,,,,,,,,,,,,,,,,,,,
11.17_UND_T2_,1,216,,"Середульшого сина ситить, жалує, поважає,",,,,,,,,,,,,,,,,,,,,,,,,,,,,,,,,,,,,,,,,,,,
11.17_UND_T2_,1,217,,За гостя принімає.,,,,,,,,,,,,,,,,,,,,,,,,,,,,,,,,,,,,,,,,,,,
11.17_UND_T2_,1,218,,"А меньший син, піша-пішаниця, за гостя приникає.",,,,,,,,,,,,,,,,,,,,,,,,,,,,,,,,,,,,,,,,,,,
11.17_UND_T2_,1,219,,"І вже ёго слава не вмре, не поляже,",,,,,,,,,,,,,,,,,,,,,,,,,,,,,,,,,,,,,,,,,,,
11.17_UND_T2_,1,220,,"Буде слава помиж царями,",,,,,,,,,,,,,,,,,,,,,,,,,,,,,,,,,,,,,,,,,,,
11.17_UND_T2_,1,221,,"Помиж панами,",,,,,,,,,,,,,,,,,,,,,,,,,,,,,,,,,,,,,,,,,,,
11.17_UND_T2_,1,222,,Помиж православними християнами.,,,,,,,,,,,,,,,,,,,,,,,,,,,,,,,,,,,,,,,,,,,
11.18_UND_T2_,1,1, Про трёх братів з Озова ,Із города із Озова  біг повчок невеличок – ,,,,,,,,,,,,,,,,,,,,,,,,,,,,,,,,,,,,,,,,,,,
11.18_UND_T2_,1,2,,"Три брати родненькі,",,,,,,,,,,,,,,,,,,,,,,,,,,,,,,,,,,,,,,,,,,,
11.18_UND_T2_,1,3,,"Голубонькі сивенькі,",,,,,,,,,,,,,,,,,,,,,,,,,,,,,,,,,,,,,,,,,,,
11.18_UND_T2_,1,4,,"Товариші сердешні,",,,,,,,,,,,,,,,,,,,,,,,,,,,,,,,,,,,,,,,,,,,
11.18_UND_T2_,1,5,,"Шо два брати – конная-конниця,",,,,,,,,,,,,,,,,,,,,,,,,,,,,,,,,,,,,,,,,,,,
11.18_UND_T2_,1,6,,"А третїй брат – піша-пішанниця,",,,,,,,,,,,,,,,,,,,,,,,,,,,,,,,,,,,,,,,,,,,
11.18_UND_T2_,1,7,,"Да поміждо ними, як чужая-чужиниця.",,,,,,,,,,,,,,,,,,,,,,,,,,,,,,,,,,,,,,,,,,,
11.18_UND_T2_,1,8,,"Тогда вуони у турецьку землю одъїзжали,",,,,,,,,,,,,,,,,,,,,,,,,,,,,,,,,,,,,,,,,,,,
11.18_UND_T2_,1,9,,А свого меншого брата покидали;,,,,,,,,,,,,,,,,,,,,,,,,,,,,,,,,,,,,,,,,,,,
11.18_UND_T2_,1,10,,А менший брат плаче-ридає,,,,,,,,,,,,,,,,,,,,,,,,,,,,,,,,,,,,,,,,,,,
11.18_UND_T2_,1,11,,І стиха словами промовляє:,,,,,,,,,,,,,,,,,,,,,,,,,,,,,,,,,,,,,,,,,,,
11.18_UND_T2_,1,12,,"«Брати мої родненькі,",,,,,,,,,,,,,,,,,,,,,,,,,,,,,,,,,,,,,,,,,,,
11.18_UND_T2_,1,13,,"Голубоньки сивенькі,",,,,,,,,,,,,,,,,,,,,,,,,,,,,,,,,,,,,,,,,,,,
11.18_UND_T2_,1,14,,Товариші сердешні!,,,,,,,,,,,,,,,,,,,,,,,,,,,,,,,,,,,,,,,,,,,
11.18_UND_T2_,1,15,,"Мене з собою ’озьміте,",,,,,,,,,,,,,,,,,,,,,,,,,,,,,,,,,,,,,,,,,,,
11.18_UND_T2_,1,16,,"Хоть по полмилі подвезіте,",,,,,,,,,,,,,,,,,,,,,,,,,,,,,,,,,,,,,,,,,,,
11.18_UND_T2_,1,17,,Або міні с пліч голову як галку зніміте».,,,,,,,,,,,,,,,,,,,,,,,,,,,,,,,,,,,,,,,,,,,
11.18_UND_T2_,1,18,,"Тогда старший брат нехороши мислі собі мав – шаблю винімав, ",,,,,,,,,,,,,,,,,,,,,,,,,,,,,,,,,,,,,,,,,,,
11.18_UND_T2_,1,19,,А сердулший брат голою рукою за шаблю хватав:,,,,,,,,,,,,,,,,,,,,,,,,,,,,,,,,,,,,,,,,,,,
11.18_UND_T2_,1,20,,"«Ой, брате мій, брате родненькій,",,,,,,,,,,,,,,,,,,,,,,,,,,,,,,,,,,,,,,,,,,,
11.18_UND_T2_,1,21,,"Голубоньку сивенький,",,,,,,,,,,,,,,,,,,,,,,,,,,,,,,,,,,,,,,,,,,,
11.18_UND_T2_,1,22,,Товаришу сердешний!,,,,,,,,,,,,,,,,,,,,,,,,,,,,,,,,,,,,,,,,,,,
11.18_UND_T2_,1,23,,Міч твій не возьми́,,,,,,,,,,,,,,,,,,,,,,,,,,,,,,,,,,,,,,,,,,,
11.18_UND_T2_,1,24,,Й рука твоя не зведи́.,,,,,,,,,,,,,,,,,,,,,,,,,,,,,,,,,,,,,,,,,,,
11.18_UND_T2_,1,25,,Хотя ж міч твій узяв,,,,,,,,,,,,,,,,,,,,,,,,,,,,,,,,,,,,,,,,,,,
11.18_UND_T2_,1,26,,"Й рука твоя звела,",,,,,,,,,,,,,,,,,,,,,,,,,,,,,,,,,,,,,,,,,,,
11.18_UND_T2_,1,27,,То нам гріха в вічнїй час не скупиться.,,,,,,,,,,,,,,,,,,,,,,,,,,,,,,,,,,,,,,,,,,,
11.18_UND_T2_,1,28,,"Лучче ми будемо тернами й байраками проїзжати,",,,,,,,,,,,,,,,,,,,,,,,,,,,,,,,,,,,,,,,,,,,
11.18_UND_T2_,1,29,,"Будемо тернам верхи стенати,",,,,,,,,,,,,,,,,,,,,,,,,,,,,,,,,,,,,,,,,,,,
11.18_UND_T2_,1,30,,Свойму меншому брату на приміту спокидати».,,,,,,,,,,,,,,,,,,,,,,,,,,,,,,,,,,,,,,,,,,,
11.18_UND_T2_,1,31,,"Да вже тогда вуони виїзжали на степи самарьськії, на шляхи муравськії",,,,,,,,,,,,,,,,,,,,,,,,,,,,,,,,,,,,,,,,,,,
11.18_UND_T2_,1,32,,"Да вже тогда не стало ні тернів, ні байраків,",,,,,,,,,,,,,,,,,,,,,,,,,,,,,,,,,,,,,,,,,,,
11.18_UND_T2_,1,33,,Ні третїхъ – козацьких признаків.,,,,,,,,,,,,,,,,,,,,,,,,,,,,,,,,,,,,,,,,,,,"муравськії , 3"
11.18_UND_T2_,1,34,,Да вже тогда середулший брат зелену китайку обриває,,,,,,,,,,,,,,,,,,,,,,,,,,,,,,,,,,,,,,,,,,,
11.18_UND_T2_,1,35,,Та свойму меншому брату на приміту спокидає.,,,,,,,,,,,,,,,,,,,,,,,,,,,,,,,,,,,,,,,,,,,
11.18_UND_T2_,1,36,,"Да вже тогда менший брат зелену китайку нахождає,",,,,,,,,,,,,,,,,,,,,,,,,,,,,,,,,,,,,,,,,,,,
11.18_UND_T2_,1,37,,"Да вже до серця прикладає 			",,,,,,,,,,,,,,,,,,,,,,,,,,,,,,,,,,,,,,,,,,,
11.18_UND_T2_,1,38,,І стиха словами промовляє:,,,,,,,,,,,,,,,,,,,,,,,,,,,,,,,,,,,,,,,,,,,
11.18_UND_T2_,1,39,,"«Ой, брати мої родненькі,",,,,,,,,,,,,,,,,,,,,,,,,,,,,,,,,,,,,,,,,,,,
11.18_UND_T2_,1,40,,"Голубонькі сивенькі,",,,,,,,,,,,,,,,,,,,,,,,,,,,,,,,,,,,,,,,,,,,
11.18_UND_T2_,1,41,,Товариші сердешні!,,,,,,,,,,,,,,,,,,,,,,,,,,,,,,,,,,,,,,,,,,,
11.18_UND_T2_,1,42,,"Чи вас порубано, чи вас живцем побрано?",,,,,,,,,,,,,,,,,,,,,,,,,,,,,,,,,,,,,,,,,,,
11.18_UND_T2_,1,43,,"Когда б я мог ваше тіло находить,",,,,,,,,,,,,,,,,,,,,,,,,,,,,,,,,,,,,,,,,,,,
11.18_UND_T2_,1,44,,"То я хоть би по коліна в землю вкопав,",,,,,,,,,,,,,,,,,,,,,,,,,,,,,,,,,,,,,,,,,,,
11.18_UND_T2_,1,45,,Та не подав би звіру-птици на поталу».,,,,,,,,,,,,,,,,,,,,,,,,,,,,,,,,,,,,,,,,,,,
11.18_UND_T2_,1,46,,"То то вуон собі промовляє,",,,,,,,,,,,,,,,,,,,,,,,,,,,,,,,,,,,,,,,,,,,
11.18_UND_T2_,1,47,,"А сам об собі не відає – не знає,",,,,,,,,,,,,,,,,,,,,,,,,,,,,,,,,,,,,,,,,,,,
11.18_UND_T2_,1,48,,Що їого в степу три пригоді спіткає:,,,,,,,,,,,,,,,,,,,,,,,,,,,,,,,,,,,,,,,,,,,
11.18_UND_T2_,1,49,,"Перва пригода – безхлібье,",,,,,,,,,,,,,,,,,,,,,,,,,,,,,,,,,,,,,,,,,,,
11.18_UND_T2_,1,50,,"Друга – безвуодье,",,,,,,,,,,,,,,,,,,,,,,,,,,,,,,,,,,,,,,,,,,,
11.18_UND_T2_,1,51,,А третяя – козацьке безголовье.,,,,,,,,,,,,,,,,,,,,,,,,,,,,,,,,,,,,,,,,,,,
11.18_UND_T2_,1,52,,"Тогда вуон до Осаул-могили прибував,",,,,,,,,,,,,,,,,,,,,,,,,,,,,,,,,,,,,,,,,,,,
11.18_UND_T2_,1,53,,Родним отцем-матерью взивав : ,,,,,,,,,,,,,,,,,,,,,,,,,,,,,,,,,,,,,,,,,,,
11.18_UND_T2_,1,54,,"«Ой, Осаул-могило, будь ти мені отець і мати!",,,,,,,,,,,,,,,,,,,,,,,,,,,,,,,,,,,,,,,,,,,
11.18_UND_T2_,1,55,,Буду я на тобі козацьку головку покладати».,,,,,,,,,,,,,,,,,,,,,,,,,,,,,,,,,,,,,,,,,,,
11.18_UND_T2_,1,56,,Як это зговорив – бардже-добре й учинив:,,,,,,,,,,,,,,,,,,,,,,,,,,,,,,,,,,,,,,,,,,,
11.18_UND_T2_,1,57,,"Очима не гляне, й ногами не пуйде, й руками не зведе.",,,,,,,,,,,,,,,,,,,,,,,,,,,,,,,,,,,,,,,,,,,
11.18_UND_T2_,1,58,,"До тогда стали до їого сизоперлиі орли налітати,",,,,,,,,,,,,,,,,,,,,,,,,,,,,,,,,,,,,,,,,,,,
11.18_UND_T2_,1,59,,"Стали на їого чорні кудрі наступати,",,,,,,,,,,,,,,,,,,,,,,,,,,,,,,,,,,,,,,,,,,,
11.18_UND_T2_,1,60,,"Й стали їого козацькую тварь зневажати,",,,,,,,,,,,,,,,,,,,,,,,,,,,,,,,,,,,,,,,,,,,
11.18_UND_T2_,1,61,,Й стали їого карі очі з лоба висмикати.,,,,,,,,,,,,,,,,,,,,,,,,,,,,,,,,,,,,,,,,,,,
11.18_UND_T2_,1,62,,Да вже вуон добрі мислі собі мав –,,,,,,,,,,,,,,,,,,,,,,,,,,,,,,,,,,,,,,,,,,,
11.18_UND_T2_,1,63,,Без міри в постолети пороху покладав,,,,,,,,,,,,,,,,,,,,,,,,,,,,,,,,,,,,,,,,,,,
11.18_UND_T2_,1,64,,Да своїм немирним гостям одсилав:,,,,,,,,,,,,,,,,,,,,,,,,,,,,,,,,,,,,,,,,,,,
11.18_UND_T2_,1,65,,"«Ой, гості, гості ви мої немирниї!",,,,,,,,,,,,,,,,,,,,,,,,,,,,,,,,,,,,,,,,,,,
11.18_UND_T2_,1,66,,"Сождіте ви час і годину, –",,,,,,,,,,,,,,,,,,,,,,,,,,,,,,,,,,,,,,,,,,,
11.18_UND_T2_,1,67,,"Буде з низу, з Ністра тихій вітер повівати,",,,,,,,,,,,,,,,,,,,,,,,,,,,,,,,,,,,,,,,,,,,
11.18_UND_T2_,1,68,,"І чорная хмара наступати,",,,,,,,,,,,,,,,,,,,,,,,,,,,,,,,,,,,,,,,,,,,
11.18_UND_T2_,1,69,,"Та дробен дощ накрапати,",,,,,,,,,,,,,,,,,,,,,,,,,,,,,,,,,,,,,,,,,,,
11.18_UND_T2_,1,70,,То тогда буде душа з тілом вѣрное прощеніе мати.,,,,,,,,,,,,,,,,,,,,,,,,,,,,,,,,,,,,,,,,,,,
11.18_UND_T2_,1,71,,"До тогда як став з низу, з Ністра тихій вітер повівати,",,,,,,,,,,,,,,,,,,,,,,,,,,,,,,,,,,,,,,,,,,,
11.18_UND_T2_,1,72,,Стали чорні хмари наступати,,,,,,,,,,,,,,,,,,,,,,,,,,,,,,,,,,,,,,,,,,,
11.18_UND_T2_,1,73,,І дробен дощик накрапати.,,,,,,,,,,,,,,,,,,,,,,,,,,,,,,,,,,,,,,,,,,,
11.18_UND_T2_,1,74,,"Да вже тогда стала душа з тілом вѣрное прощеніе мати,",,,,,,,,,,,,,,,,,,,,,,,,,,,,,,,,,,,,,,,,,,,
11.18_UND_T2_,1,75,,"Стали до їого сизоперлиі орли налітати,",,,,,,,,,,,,,,,,,,,,,,,,,,,,,,,,,,,,,,,,,,,
11.18_UND_T2_,1,76,,Стали звірі набігати...,,,,,,,,,,,,,,,,,,,,,,,,,,,,,,,,,,,,,,,,,,,
11.18_UND_T2_,1,77,,"Рознесли кості по тернах та по байраках,",,,,,,,,,,,,,,,,,,,,,,,,,,,,,,,,,,,,,,,,,,,
11.18_UND_T2_,1,78,,Та по третьихъ – козацькихъ признаках.,,,,,,,,,,,,,,,,,,,,,,,,,,,,,,,,,,,,,,,,,,,
11.18_UND_T2_,1,79,,А тогда вже середулший брат добрі мислі собі мав,,,,,,,,,,,,,,,,,,,,,,,,,,,,,,,,,,,,,,,,,,,
11.18_UND_T2_,1,80,,Да да свого старшого брата стиха словами промовляв:,,,,,,,,,,,,,,,,,,,,,,,,,,,,,,,,,,,,,,,,,,,
11.18_UND_T2_,1,81,,"«Ой, брате  родненькій,",,,,,,,,,,,,,,,,,,,,,,,,,,,,,,,,,,,,,,,,,,,
11.18_UND_T2_,1,82,,"Голубоньку сивенький,",,,,,,,,,,,,,,,,,,,,,,,,,,,,,,,,,,,,,,,,,,,
11.18_UND_T2_,1,83,,Товаришу сердешний!,,,,,,,,,,,,,,,,,,,,,,,,,,,,,,,,,,,,,,,,,,,
11.18_UND_T2_,1,84,,Сождімо ми свого меншого брата».,,,,,,,,,,,,,,,,,,,,,,,,,,,,,,,,,,,,,,,,,,,
11.18_UND_T2_,1,85,,А старший брат нехороші мислі собі мав,,,,,,,,,,,,,,,,,,,,,,,,,,,,,,,,,,,,,,,,,,,
11.18_UND_T2_,1,86,,І стиха словами промовляв:,,,,,,,,,,,,,,,,,,,,,,,,,,,,,,,,,,,,,,,,,,,
11.18_UND_T2_,1,87,,"«Нащо нам – каже, – брате,",,,,,,,,,,,,,,,,,,,,,,,,,,,,,,,,,,,,,,,,,,,
11.18_UND_T2_,1,88,,Меншого брата ожидати?,,,,,,,,,,,,,,,,,,,,,,,,,,,,,,,,,,,,,,,,,,,
11.18_UND_T2_,1,89,,"Дасть Бог, приїдем додому,",,,,,,,,,,,,,,,,,,,,,,,,,,,,,,,,,,,,,,,,,,,
11.18_UND_T2_,1,90,,"Будем навполи худобу поїовати,",,,,,,,,,,,,,,,,,,,,,,,,,,,,,,,,,,,,,,,,,,,
11.18_UND_T2_,1,91,,То вже поміждо нами не буде третїої попереки».,,,,,,,,,,,,,,,,,,,,,,,,,,,,,,,,,,,,,,,,,,,
11.18_UND_T2_,1,92,,А сердулший брат стиха словами промовляє:,,,,,,,,,,,,,,,,,,,,,,,,,,,,,,,,,,,,,,,,,,,
11.18_UND_T2_,1,93,,"«’Эй, брате родненькій,",,,,,,,,,,,,,,,,,,,,,,,,,,,,,,,,,,,,,,,,,,,
11.18_UND_T2_,1,94,,"Голубоньку сивенький,",,,,,,,,,,,,,,,,,,,,,,,,,,,,,,,,,,,,,,,,,,,
11.18_UND_T2_,1,95,,Товаришу сердешний!,,,,,,,,,,,,,,,,,,,,,,,,,,,,,,,,,,,,,,,,,,,
11.18_UND_T2_,1,96,,Шо ж ми тепер будем своїй матери казати?» –,,,,,,,,,,,,,,,,,,,,,,,,,,,,,,,,,,,,,,,,,,,
11.18_UND_T2_,1,97,,"«Шо ми не в одного турчина пробували,",,,,,,,,,,,,,,,,,,,,,,,,,,,,,,,,,,,,,,,,,,,
11.18_UND_T2_,1,98,,Не одну хліб-соль вживали».,,,,,,,,,,,,,,,,,,,,,,,,,,,,,,,,,,,,,,,,,,,
11.18_UND_T2_,1,99,,"До вже тогда вуони прибували до річки Полтавки,",,,,,,,,,,,,,,,,,,,,,,,,,,,,,,,,,,,,,,,,,,,
11.18_UND_T2_,1,100,,"До криниці Салтанки,",,,,,,,,,,,,,,,,,,,,,,,,,,,,,,,,,,,,,,,,,,,
11.18_UND_T2_,1,101,,Да там стали свої коні попасати.,,,,,,,,,,,,,,,,,,,,,,,,,,,,,,,,,,,,,,,,,,,
11.18_UND_T2_,1,102,,"До тогда став із низу, із Ністра тихій вітер повівати,",,,,,,,,,,,,,,,,,,,,,,,,,,,,,,,,,,,,,,,,,,,
11.18_UND_T2_,1,103,,"Чорні хмари наступати,",,,,,,,,,,,,,,,,,,,,,,,,,,,,,,,,,,,,,,,,,,,
11.18_UND_T2_,1,104,,До стала їх турецька погоня здоганяти.,,,,,,,,,,,,,,,,,,,,,,,,,,,,,,,,,,,,,,,,,,,
11.18_UND_T2_,1,105,,Посікли й порубали. Там вуони й померли;,,,,,,,,,,,,,,,,,,,,,,,,,,,,,,,,,,,,,,,,,,,
11.18_UND_T2_,1,106,,А їх слава не помре й не поляже.,,,,,,,,,,,,,,,,,,,,,,,,,,,,,,,,,,,,,,,,,,,
11.18_UND_T2_,1,107,,"Утверди, Господи, люду царського, императорського",,,,,,,,,,,,,,,,,,,,,,,,,,,,,,,,,,,,,,,,,,,
11.18_UND_T2_,1,108,,"І самодержця императора нашого Олександру Миколаїовича,",,,,,,,,,,,,,,,,,,,,,,,,,,,,,,,,,,,,,,,,,,,
11.18_UND_T2_,1,109,,"І всім слуша́ющим пошли, Боже, много літ.",,,,,,,,,,,,,,,,,,,,,,,,,,,,,,,,,,,,,,,,,,,
11.19_UND_T2_,1,1,Як три брати утікали ,"Ой с-під города, с-під Озова",,,,,,,,,,,,,,,,,,,,,,,,,,,,,,,,,,,,,,,,,,,
11.19_UND_T2_,1,2,,"Тож не тумани уставали,",,,,,,,,,,,,,,,,,,,,,,,,,,,,,,,,,,,,,,,,,,,
11.19_UND_T2_,1,3,,"Не чорніі хмари набігали,",,,,,,,,,,,,,,,,,,,,,,,,,,,,,,,,,,,,,,,,,,,
11.19_UND_T2_,1,4,,"Не дрібніі дощі накрапали,",,,,,,,,,,,,,,,,,,,,,,,,,,,,,,,,,,,,,,,,,,,
11.19_UND_T2_,1,5,,"Як три братіки рідненькіх,",,,,,,,,,,,,,,,,,,,,,,,,,,,,,,,,,,,,,,,,,,,
11.19_UND_T2_,1,6,,"Голубоньки сивенькі,",,,,,,,,,,,,,,,,,,,,,,,,,,,,,,,,,,,,,,,,,,,
11.19_UND_T2_,1,7,,"С-під города, с-під Озова",,,,,,,,,,,,,,,,,,,,,,,,,,,,,,,,,,,,,,,,,,,
11.19_UND_T2_,1,8,,З тяжкоі неволі утікали.,,,,,,,,,,,,,,,,,,,,,,,,,,,,,,,,,,,,,,,,,,,
11.19_UND_T2_,1,9,,"Два брата кінних,",,,,,,,,,,,,,,,,,,,,,,,,,,,,,,,,,,,,,,,,,,,
11.19_UND_T2_,1,10,,"Третій брат меньшій – піша-пішаниця,",,,,,,,,,,,,,,,,,,,,,,,,,,,,,,,,,,,,,,,,,,,
11.19_UND_T2_,1,11,,"За кінними братами угоняє,",,,,,,,,,,,,,,,,,,,,,,,,,,,,,,,,,,,,,,,,,,,
11.19_UND_T2_,1,12,,"За стремена хватає,",,,,,,,,,,,,,,,,,,,,,,,,,,,,,,,,,,,,,,,,,,,
11.19_UND_T2_,1,13,,"Слёзами обливає,",,,,,,,,,,,,,,,,,,,,,,,,,,,,,,,,,,,,,,,,,,,
11.19_UND_T2_,1,14,,Словами промовляє:,,,,,,,,,,,,,,,,,,,,,,,,,,,,,,,,,,,,,,,,,,,
11.19_UND_T2_,1,15,,"«Братіки рідненькі,",,,,,,,,,,,,,,,,,,,,,,,,,,,,,,,,,,,,,,,,,,,
11.19_UND_T2_,1,16,,"Голубоньки сивенькі,",,,,,,,,,,,,,,,,,,,,,,,,,,,,,,,,,,,,,,,,,,,
11.19_UND_T2_,1,17,,"Возьміть мене хочъ між коні,",,,,,,,,,,,,,,,,,,,,,,,,,,,,,,,,,,,,,,,,,,,
11.19_UND_T2_,1,18,,"До отця, до матушки",,,,,,,,,,,,,,,,,,,,,,,,,,,,,,,,,,,,,,,,,,,
11.19_UND_T2_,1,19,,В землю христіянськую надвезіте».,,,,,,,,,,,,,,,,,,,,,,,,,,,,,,,,,,,,,,,,,,,
11.19_UND_T2_,1,20,,"Старшій брат зачуває,",,,,,,,,,,,,,,,,,,,,,,,,,,,,,,,,,,,,,,,,,,,
11.19_UND_T2_,1,21,,До найменьшого брата словами промовляє:,,,,,,,,,,,,,,,,,,,,,,,,,,,,,,,,,,,,,,,,,,,
11.19_UND_T2_,1,22,,"«Найменьшій братіку рідненькій,",,,,,,,,,,,,,,,,,,,,,,,,,,,,,,,,,,,,,,,,,,,
11.19_UND_T2_,1,23,,"Голубоньку сивенькій,",,,,,,,,,,,,,,,,,,,,,,,,,,,,,,,,,,,,,,,,,,,
11.19_UND_T2_,1,24,,"Ради б ми тебе між коні узяти,",,,,,,,,,,,,,,,,,,,,,,,,,,,,,,,,,,,,,,,,,,,
11.19_UND_T2_,1,25,,"Буде озовська орда догоняти,",,,,,,,,,,,,,,,,,,,,,,,,,,,,,,,,,,,,,,,,,,,
11.19_UND_T2_,1,26,,"Буде у пень сікти-рубати,",,,,,,,,,,,,,,,,,,,,,,,,,,,,,,,,,,,,,,,,,,,
11.19_UND_T2_,1,27,,"Назад у Озов-город завертати,",,,,,,,,,,,,,,,,,,,,,,,,,,,,,,,,,,,,,,,,,,,
11.19_UND_T2_,1,28,,Ніяк нам буде утікати».,,,,,,,,,,,,,,,,,,,,,,,,,,,,,,,,,,,,,,,,,,,
11.19_UND_T2_,1,29,,"Тоє промовляли,",,,,,,,,,,,,,,,,,,,,,,,,,,,,,,,,,,,,,,,,,,,
11.19_UND_T2_,1,30,,Відтіля побігали.,,,,,,,,,,,,,,,,,,,,,,,,,,,,,,,,,,,,,,,,,,,
11.19_UND_T2_,1,31,,"Найменьшій брат, піша-пішаниця,",,,,,,,,,,,,,,,,,,,,,,,,,,,,,,,,,,,,,,,,,,,
11.19_UND_T2_,1,32,,"За старшими братами угоняє,",,,,,,,,,,,,,,,,,,,,,,,,,,,,,,,,,,,,,,,,,,,
11.19_UND_T2_,1,33,,"Коні за стремена хватає,",,,,,,,,,,,,,,,,,,,,,,,,,,,,,,,,,,,,,,,,,,,
